{
  "protocol": "dev.jazz.guided-execution-fixture",
  "protocolVersion": 1,
  "approvedRunbook": {
    "runbookId": "rb_11111111111111111111111111111111",
    "runbookVersionId": "rbv_22222222222222222222222222222222",
    "contentDigest": "sha256:aaaaaaaaaaaaaaaaaaaaaaaaaaaaaaaaaaaaaaaaaaaaaaaaaaaaaaaaaaaaaaaa",
    "version": 3,
    "scope": {
      "companyId": "company-acme",
      "areaId": "finance",
      "processId": "issue-invoice"
    },
    "status": "approved"
  },
  "decision": {
    "artifactType": "guidedReplayDecision",
    "schemaVersion": "1",
    "decisionId": "grd_43276d20618ad9a3c4e937da2ebe5ab3",
    "contentDigest": "sha256:43276d20618ad9a3c4e937da2ebe5ab33b68bc3123965e701f03ad0bc9d8993f",
    "requestDigest": "sha256:8ccd5e609be5e53003f8e7ef0649ccd7fe8cafcc5bba6c7402fea29d05d912a4",
    "request": {
      "requestVersion": "1",
      "executionId": "execution-invoice-42",
      "scope": {
        "companyId": "company-acme",
        "areaId": "finance",
        "processId": "issue-invoice"
      },
      "runbookVersionId": "rbv_22222222222222222222222222222222",
      "runbookContentDigest": "sha256:aaaaaaaaaaaaaaaaaaaaaaaaaaaaaaaaaaaaaaaaaaaaaaaaaaaaaaaaaaaaaaaa",
      "operatorId": "substitute-bob",
      "requestedAt": "2026-07-23T08:59:00.000000Z",
      "idempotencyKey": "jazz-op-v1:externalKey:82f7227db6e4c319:bo_ef2d1e30182193186b7927e7de5148ee:post",
      "targetStepId": "rbs_44444444444444444444444444444442",
      "locatorResolution": {
        "stepId": "rbs_44444444444444444444444444444442",
        "locatorId": "rbl_55555555555555555555555555555551",
        "kind": "accessibility",
        "matchCount": 1,
        "applicationId": "com.acme.erp",
        "resolvedAt": "2026-07-23T08:59:45.000000Z",
        "evidence": [{"kind": "observation", "ref": "runtime:locator:post-button"}]
      },
      "capabilities": [
        {"id": "human-guided-replay", "version": "1"},
        {"id": "macos.accessibility.semantic", "version": "1"}
      ],
      "preconditions": [
        {
          "conditionId": "invoice-draft-open",
          "satisfied": true,
          "evidence": [{"kind": "screenshot", "ref": "runtime:invoice-draft-open"}]
        }
      ],
      "approvals": [
        {
          "approvalId": "gra_a2877327552f794b2a961099d1ba96df",
          "stepId": "rbs_44444444444444444444444444444442",
          "executionId": "execution-invoice-42",
          "decision": "approved",
          "approverId": "finance-manager-carol",
          "approverRole": "finance-manager",
          "approvalPolicy": {
            "policyId": "finance-replay-approvers",
            "revision": "7",
            "policyDigest": "sha256:abababababababababababababababababababababababababababababababab",
            "policySource": "area-registry:finance",
            "approverRole": "finance-manager",
            "resolvedAt": "2026-07-23T08:58:00.000000Z",
            "validFrom": "2026-07-23T00:00:00.000000Z",
            "validUntil": "2026-07-24T00:00:00.000000Z"
          },
          "approvalScopeKey": "step:rbs_44444444444444444444444444444442",
          "decidedAt": "2026-07-23T08:58:00.000000Z",
          "expiresAt": "2026-07-23T10:00:00.000000Z",
          "boundRunbookVersionId": "rbv_22222222222222222222222222222222",
          "boundRunbookContentDigest": "sha256:aaaaaaaaaaaaaaaaaaaaaaaaaaaaaaaaaaaaaaaaaaaaaaaaaaaaaaaaaaaaaaaa"
        }
      ],
      "applicationObservations": [
        {
          "applicationId": "com.acme.erp",
          "observedVersion": "5.7.2",
          "environment": "production",
          "matchedVersionConstraint": ">=5.7,<6",
          "compatibility": "compatible",
          "resolver": {"id": "macos-bundle", "version": "1"},
          "observedAt": "2026-07-23T08:59:40.000000Z",
          "evidence": [{"kind": "event", "ref": "runtime:bundle-version"}]
        }
      ],
      "businessObjectInputs": [
        {
          "role": "invoice",
          "scope": {
            "companyId": "company-acme",
            "areaId": "finance",
            "processId": "issue-invoice"
          },
          "systemNamespace": "erp",
          "connectionId": "erp-production",
          "objectType": "invoice",
          "externalId": "INV-42",
          "anchorAssertionRef": "boa-dddddddddddddddddddddddddddddddddddddddddddddddddddddddddddddddd",
          "anchorAssertionDigest": "sha256:dddddddddddddddddddddddddddddddddddddddddddddddddddddddddddddddd",
          "outcome": "verified",
          "lifecycle": "verified",
          "freshness": {
            "status": "fresh",
            "checkedAt": "2026-07-23T08:59:30.000000Z",
            "expiresAt": "2026-07-23T10:00:00.000000Z"
          },
          "resolvedAt": "2026-07-23T08:59:30.000000Z",
          "evidence": [{"kind": "assertion", "ref": "anchor:invoice:INV-42"}]
        }
      ]
    },
    "runbook": {
      "runbookId": "rb_11111111111111111111111111111111",
      "runbookVersionId": "rbv_22222222222222222222222222222222",
      "contentDigest": "sha256:aaaaaaaaaaaaaaaaaaaaaaaaaaaaaaaaaaaaaaaaaaaaaaaaaaaaaaaaaaaaaaaa",
      "version": 3,
      "scope": {
        "companyId": "company-acme",
        "areaId": "finance",
        "processId": "issue-invoice"
      }
    },
    "evaluatedAt": "2026-07-23T08:59:50.000000Z",
    "validationPolicy": {"maxAgeSeconds": 120},
    "trustedRuntimeContext": {
      "resolver": {"id": "trusted-desktop-runtime", "version": "1"},
      "resolvedAt": "2026-07-23T08:59:50.000000Z",
      "requestContextDigest": "sha256:603e8503efe215738ff4e5c675e4604ec464ab984af12dbab290f8a0eae04fdd",
      "capabilities": [
        {"id": "human-guided-replay", "version": "1", "evidence": [{"kind": "assertion", "ref": "runtime:capability:human-guided-replay"}]},
        {"id": "macos.accessibility.semantic", "version": "1", "evidence": [{"kind": "assertion", "ref": "runtime:capability:accessibility"}]}
      ],
      "preconditions": [
        {
          "conditionId": "invoice-draft-open",
          "satisfied": true,
          "evidence": [{"kind": "screenshot", "ref": "runtime:invoice-draft-open"}]
        }
      ],
      "locatorResolution": {
        "stepId": "rbs_44444444444444444444444444444442",
        "locatorId": "rbl_55555555555555555555555555555551",
        "kind": "accessibility",
        "matchCount": 1,
        "applicationId": "com.acme.erp",
        "resolvedAt": "2026-07-23T08:59:45.000000Z",
        "evidence": [{"kind": "screenshot", "ref": "runtime:locator:post-button"}]
      },
      "applicationObservations": [
        {
          "applicationId": "com.acme.erp",
          "observedVersion": "5.7.2",
          "environment": "production",
          "matchedVersionConstraint": ">=5.7,<6",
          "compatibility": "compatible",
          "resolver": {"id": "macos-bundle", "version": "1"},
          "observedAt": "2026-07-23T08:59:40.000000Z",
          "evidence": [{"kind": "event", "ref": "runtime:bundle-version"}]
        }
      ],
      "evidence": [{"kind": "assertion", "ref": "runtime:trusted-resolution"}]
    },
    "trustedAnchorPins": [
      {
        "assertionId": "boa-dddddddddddddddddddddddddddddddddddddddddddddddddddddddddddddddd",
        "contentDigest": "sha256:dddddddddddddddddddddddddddddddddddddddddddddddddddddddddddddddd",
        "scope": {
          "companyId": "company-acme",
          "areaId": "finance",
          "processId": "issue-invoice"
        },
        "outcome": "verified",
        "lifecycle": "verified",
        "retrievedAt": "2026-07-23T08:59:30.000000Z",
        "object": {
          "connectionId": "erp-production",
          "systemNamespace": "erp",
          "objectType": "invoice",
          "externalId": "INV-42"
        },
        "freshness": {
          "status": "fresh",
          "checkedAt": "2026-07-23T08:59:30.000000Z",
          "expiresAt": "2026-07-23T10:00:00.000000Z"
        }
      }
    ],
    "trustedApprovalStates": [
      {
        "approvalId": "gra_a2877327552f794b2a961099d1ba96df",
        "policyId": "finance-replay-approvers",
        "revision": "7",
        "policyDigest": "sha256:abababababababababababababababababababababababababababababababab",
        "approverRole": "finance-manager",
        "resolvedAt": "2026-07-23T08:59:50.000000Z",
        "status": "active"
      }
    ],
    "attemptNumber": 1,
    "logicalOperationKey": "jazz-op-v1:externalKey:82f7227db6e4c319:bo_ef2d1e30182193186b7927e7de5148ee:post",
    "status": "ready",
    "checks": [
      {"kind": "runbookReview", "key": "approved", "status": "pass", "reason": "Exact approved digest.", "evidence": []},
      {"kind": "sequence", "key": "step-1", "status": "pass", "reason": "Prior handoff step succeeded.", "evidence": []},
      {"kind": "capability", "key": "desktop", "status": "pass", "reason": "Required capabilities declared.", "evidence": []},
      {"kind": "precondition", "key": "invoice-draft-open", "status": "pass", "reason": "Draft is open.", "evidence": [{"kind": "screenshot", "ref": "runtime:invoice-draft-open"}]},
      {"kind": "locator", "key": "post-button", "status": "pass", "reason": "One semantic target.", "evidence": [{"kind": "screenshot", "ref": "runtime:locator:post-button"}]},
      {"kind": "application", "key": "com.acme.erp", "status": "pass", "reason": "Compatible version.", "evidence": []},
      {"kind": "businessObject", "key": "invoice", "status": "pass", "reason": "Trusted invoice anchor is fresh.", "evidence": [{"kind": "assertion", "ref": "anchor:invoice:INV-42"}]},
      {"kind": "approval", "key": "finance-manager", "status": "pass", "reason": "Approval bound to this step and digest.", "evidence": []},
      {"kind": "idempotency", "key": "jazz-op-v1:externalKey:82f7227db6e4c319:bo_ef2d1e30182193186b7927e7de5148ee:post", "status": "pass", "reason": "No prior side effect uses this key.", "evidence": []}
    ],
    "authorizedStep": {